text,followers,timestamp,compound
"Kraft Heinz coverage started at buy at Mizuho, citing 'portfolio with potential'  https://t.co/oEalu6AJ6e",499867,1781738457,0.0
Morgan Stanley says these global stocks are set for earnings beats — and gives one over 45% upside  https://t.co/GeWxa5YoWr,498631,1781738457,0.0
Argus downgrades Delta citing weak outlook following second-quarter earnings  https://t.co/MuWXm66fAo,497135,1781738457,-0.4404
Investing Club: Analysts dropped a bunch of new notes on energy stocks. Here's where we stand on ours  https://t.co/faKcXzyMGZ,497066,1781738457,0.2732
Morningstar strategist says two FAANG stocks look incredibly cheap right now  https://t.co/DKr5Q5o0ei,494914,1781738457,0.0
AM Best Comments on Credit Ratings of Athora Holding Ltd.’s Subs Following its Announced Acquisition of a Closed Life and Pension Portfolio  https://t.co/ewg89dtPPE  https://t.co/tIrduKQ5oZ,479133,1781738457,0.7783
Evercore ISI says 'gazumped growth growers' could do well in a potentially tough earnings season  https://t.co/I1nrduZ7UB,464818,1781738457,0.4939
$FRLN just out: Wedbush Outperform rating and $3 PT,463209,1781738457,0.0
"Apple's near-term future looks murky as consumer spending slows, Bernstein says  https://t.co/21T9LREta4",458320,1781738457,0.0
"Here are Monday's biggest analyst calls of the day: Tesla, Apple, Yum, Delta, Fox, Netflix &amp; more  https://t.co/Pt2oqzwPvB",455662,1781738457,0.0
